<?xml version="1.0" encoding="utf-8"?>
<!DOCTYPE Formular SYSTEM "Feedback.dtd">
<Formular Datum="10.12.2022" Uhrzeit="14:57">
    <Person>
        <Anrede>Frau</Anrede>
        <Vorname>Erika</Vorname>
        <Nachname>Mustermann</Nachname>
        <Datum>10.12.2022</Datum>
        <Uhrzeit>14:57</Uhrzeit>
        <Alter>55</Alter>
    </Person>
    <Kontakt>
        <E-Mail>must@gmail.com</E-Mail>
        <Telefonnummer>123164512</Telefonnummer>
        <Webseite>https://www.tutorialspoint.com/xerces/xerces_dom_create_document.htm</Webseite>
        <Kopie_erstellen>nein</Kopie_erstellen>
        <Zurückmelden>nein</Zurückmelden>
    </Kontakt>
    <Feedback>
        <Verbesserungen>sehr gut</Verbesserungen>
        <Erneut_besuchen>ja</Erneut_besuchen>
        <Aufmerksam>zufall</Aufmerksam>
        <Inhalt_bewertung>2</Inhalt_bewertung>
        <Aussehen_bewertung>4</Aussehen_bewertung>
    </Feedback>
</Formular>
